slug,title,year,missing_fields
attention-deficit-hyperactivity-disorder-knowledge-and-perception-of-dental-care-providers-2017,Attention Deficit Hyperactivity Disorder: Knowledge and Perception of Dental Care Providers,2017,authors;identifiers.doi
attention-deficit-hyperactivity-symptoms-among-al-dawadmi-primary-schools-children-as-reported-by-their-teachers-2016,Attention Deficit Hyperactivity Symptoms among Al Dawadmi Primary Schools Children as Reported by Their Teachers,2016,authors;access.localPdfUrl;identifiers.doi
awareness-and-knowledge-of-attention-deficit-hyperactivity-disorder-among-the-population-of-hail-saudi-arabia-2020,"Awareness and Knowledge of Attention Deficit Hyperactivity Disorder among the Population of Hail, Saudi Arabia",2020,authors;access.localPdfUrl;identifiers.doi
awareness-of-attention-deficit-hyperactivity-disorder-among-special-education-students-in-riyadh-and-qassim-regions-of-saudi-arabia-cross-sectional-study-2023,Awareness of Attention Deficit Hyperactivity Disorder Among Special Education Students in Riyadh and Qassim Regions of Saudi Arabia – Cross Sectional Study,2023,authors;identifiers.doi
behavioral-problems-associated-with-attention-deficithyperactivity-disorder-among-students-as-perceived-by-elementary-school-teachers-in-riyadh-arabic-2015,Behavioral Problems Associated with Attention Deficit/Hyperactivity Disorder Among Students As Perceived by Elementary School Teachers in Riyadh [Arabic],2015,authors;identifiers.doi
challenging-gifted-children-and-the-phenomenon-of-adhd-a-qualitative-study-of-teachers-and-parents-perceptions-in-a-saudi-arabian-primary-school-2010,Challenging Gifted Children and the Phenomenon of AD/HD: A Qualitative Study of Teachers’ and Parents’ Perceptions in a Saudi Arabian Primary School,2010,authors;identifiers.doi
co-morbidity-and-treatment-of-attention-deficit-hyperactivity-disorder-in-saudi-arabia-2003,Co-morbidity and treatment of attention deficit hyperactivity disorder in Saudi Arabia,2003,authors;identifiers.doi
effect-of-omega-3-fatty-acid-supplementation-on-some-of-the-physiological-changes-in-boys-with-moderate-adhd-symptoms-2018,Effect of Omega-3 Fatty Acid Supplementation on Some of the Physiological Changes in Boys with Moderate ADHD Symptoms,2018,authors;identifiers.doi
effect-of-regular-aerobic-exercises-on-behavioral-cognitive-and-psychological-response-in-patients-with-attention-deficit-hyperactivity-disorder-2011,"Effect of Regular Aerobic Exercises on Behavioral, Cognitive and Psychological Response in Patients with Attention Deficit-Hyperactivity Disorder",2011,authors;access.localPdfUrl;identifiers.doi
effectiveness-of-an-instructional-program-for-teachers-in-alleviating-attention-deficit-hyperactivity-disorder-adhd-for-kindergarten-and-the-attitude-towards-them-arabic-2015,Effectiveness of an Instructional Program for Teachers in alleviating Attention Deficit Hyperactivity Disorder (ADHD) for kindergarten and the attitude towards them [Arabic],2015,authors;access.localPdfUrl;identifiers.doi
effectiveness-of-health-educational-program-on-parents-coping-strategies-and-their-children-with-attention-deficit-hyperactivity-disorder-2013,Effectiveness of Health Educational Program on Parents’ Coping Strategies and their Children with Attention Deficit Hyperactivity Disorder,2013,authors;identifiers.doi
effectiveness-of-the-proposed-training-program-on-attention-and-working-memory-for-children-with-special-needs-in-saudi-arabia-2014,Effectiveness of the proposed training program on attention and working memory for children with special needs in Saudi Arabia,2014,authors;access.localPdfUrl;identifiers.doi
effects-of-teaching-art-activities-by-using-the-playing-method-to-develop-skills-in-preschool-children-with-attention-deficit-hyperactivity-disorder-2013,Effects of Teaching Art Activities by Using the Playing Method to Develop Skills in Preschool Children with Attention Deficit Hyperactivity Disorder,2013,authors;identifiers.doi
emotional-and-behavioral-problems-among-male-saudi-schoolchildren-and-adolescents-prevalence-and-risk-factors-2004,Emotional and Behavioral Problems Among Male Saudi Schoolchildren and Adolescents: Prevalence and Risk Factors,2004,authors;identifiers.doi
enhancement-the-awareness-of-family-care-givers-caring-their-children-with-attention-deficit-hyperactivity-disorder-of-the-general-administration-of-intellectual-education-centers-in-the-city-of-abha-2013,Enhancement the Awareness of Family Care givers Caring their Children With Attention Deficit Hyperactivity Disorder of the General Administration of Intellectual Education Centers in the city of Abha,2013,authors;identifiers.doi
evaluation-of-plasma-neurotransmitters-in-children-living-with-attention-deficit-hyperactivity-disorder-adhd-2018,Evaluation of plasma neurotransmitters in children living with Attention-Deficit Hyperactivity Disorder (ADHD),2018,authors;identifiers.doi
eye-controlled-games-for-behavioral-therapy-of-attention-deficit-disorders-2013,Eye-Controlled Games for Behavioral Therapy of Attention Deficit Disorders,2013,authors;identifiers.doi
how-teachers-knowledge-of-attention-deficit-hyperactivity-disorder-makes-difference-in-doctors-diagnostic-decisions-and-management-2015,How teachers’ knowledge of attention deficit hyperactivity disorder makes difference in doctors’ diagnostic decisions and management?,2015,authors;identifiers.doi
implementation-of-peer-tutoring-strategies-in-teaching-students-with-adhd-teachers-attitudes-in-saudi-education-2016,Implementation of Peer Tutoring Strategies in Teaching Students with ADHD: Teachers' Attitudes in Saudi Education,2016,authors;identifiers.doi
interactive-serious-gaming-for-children-with-auditory-processing-difficulties-in-the-arabic-language-2013,Interactive Serious Gaming for Children with Auditory Processing Difficulties in the Arabic Language,2013,authors;identifiers.doi
involving-children-with-adhd-and-their-parents-in-research-in-saudi-arabia-2014,Involving Children with ADHD and Their Parents in Research in Saudi Arabia,2014,journal.name;authors;identifiers.doi
knowledge-of-effective-educational-interventions-among-teachers-of-students-of-attention-deficit-hyperactivity-disorder-arabic-2020,Knowledge of Effective Educational Interventions among Teachers of Students of Attention Deficit Hyperactivity Disorder [Arabic],2020,authors;identifiers.doi
knowledge-of-kindergarten-teachers-of-adhd-and-its-relationship-with-some-variables-arabic-2020,Knowledge of Kindergarten Teachers of ADHD and Its Relationship with Some Variables [Arabic],2020,authors;identifiers.doi
legislative-rules-for-students-with-disabilities-in-the-united-states-and-saudi-arabia-a-comparative-study-2013,Legislative Rules for Students with Disabilities in the United States and Saudi Arabia: A Comparative Study,2013,authors;identifiers.doi
levels-of-zinc-magnesium-and-iron-in-children-with-attention-deficit-hyperactivity-disorder-2017,"Levels of Zinc, Magnesium and Iron in Children with Attention Deficit Hyperactivity Disorder",2017,authors;identifiers.doi
medical-and-psychiatric-comorbidity-in-the-patients-with-intellectual-disability-in-a-rehabilitation-setting-kingdom-of-saudi-arabia-2022,"Medical and psychiatric comorbidity in the patients with intellectual disability in a rehabilitation setting, Kingdom of Saudi Arabia",2022,authors;access.localPdfUrl;identifiers.doi
pattern-of-child-and-adolescent-psychiatric-disorders-among-patients-consulting-publicly-funded-child-psychiatric-clinics-in-saudi-arabia-2012,Pattern of child and adolescent psychiatric disorders among patients consulting publicly-funded child psychiatric clinics in Saudi Arabia,2012,authors;identifiers.doi
prevalence-of-attention-deficit-and-hyperactivity-disorder-adhd-in-children-attending-paediatric-endocrine-clinic-at-king-khalid-university-hospital-riyadh-saudi-arabia-2019,"Prevalence of Attention Deficit and Hyperactivity Disorder (ADHD) in Children Attending Paediatric Endocrine Clinic at King Khalid University Hospital, Riyadh, Saudi Arabia",2019,authors;access.localPdfUrl;identifiers.doi
prevalence-of-attention-deficit-and-hyperactivity-disorder-among-primary-school-students-in-jeddah-city-ksa-2013,"Prevalence of Attention Deficit and Hyperactivity Disorder among Primary School Students in Jeddah city, KSA",2013,authors;identifiers.doi
prevalence-of-attention-deficit-and-hyperactivity-disorder-in-children-with-language-impairments-and-speech-disorders-2016,Prevalence of Attention Deficit and Hyperactivity Disorder in Children with Language Impairments and Speech Disorders,2016,authors;access.localPdfUrl;identifiers.doi
saudi-arabian-teachers-knowledge-and-beliefs-about-adhd-2014,Saudi Arabian Teachers’ Knowledge and Beliefs about ADHD,2014,authors;identifiers.doi
saudi-children-with-attention-deficit-hyperactivity-disorder-adhd-and-their-assessment-of-teachers-knowledge-2022,Saudi children with attention deficit hyperactivity disorder (ADHD) and their assessment of teachers' knowledge,2022,authors;access.localPdfUrl;identifiers.doi
sensation-seeking-and-delinquency-among-saudi-adolescents-2011,Sensation Seeking and Delinquency among Saudi Adolescents,2011,authors;identifiers.doi
study-regarding-the-level-of-awareness-and-understanding-about-adhd-among-teachers-when-dealing-with-adhd-students-2022,Study regarding the level of awareness and understanding about ADHD among teachers when dealing with ADHD students,2022,authors;identifiers.doi
the-acquisition-of-discourse-markers-in-arabic-first-language-acquisition-a-case-study-of-a-saudi-adhd-child-2012,The Acquisition of Discourse Markers in Arabic First Language Acquisition: A Case Study of a Saudi ADHD Child,2012,authors;identifiers.doi
the-impact-of-parents-medication-beliefs-on-adhd-management-2015,The Impact of Parents’ Medication Beliefs on ADHD Management,2015,authors;identifiers.doi
the-knowledge-and-beliefs-concerning-attention-deficit-hyperactivity-disorder-adhd-held-by-children-with-adhd-in-saudi-arabia-2014,The knowledge and beliefs concerning attention deficit hyperactivity disorder (ADHD) held by children with ADHD in Saudi Arabia,2014,authors;identifiers.doi
the-need-for-teaching-strategies-for-students-with-attention-deficit-hyperactivity-disorder-at-saudi-arabian-schools-2016,The Need for Teaching Strategies for Students with Attention Deficit Hyperactivity Disorder at Saudi Arabian Schools,2016,authors;identifiers.doi
the-new-educators-the-reasons-for-saudi-arabia-to-invest-more-in-student-counseling-programs-2016,The New Educators: The Reasons for Saudi Arabia to Invest More in Student Counseling Programs,2016,authors;access.localPdfUrl;identifiers.doi
the-possible-impact-of-interlocutor-familiarity-on-verbal-interaction-in-children-with-adhd-2016,The Possible Impact of Interlocutor Familiarity on Verbal Interaction in Children with ADHD,2016,authors;identifiers.doi
the-relationship-between-attention-deficit-and-hyperactivity-disorder-adhd-and-learning-disabilities-2015,The Relationship between Attention Deficit & Hyperactivity Disorder ADHD and Learning Disabilities,2015,authors;identifiers.doi
the-use-of-omega-3-fatty-acids-as-an-alternative-treatment-for-attention-deficit-hyperactivity-disorder-in-children-2016,The Use of Omega-3 Fatty Acids as an Alternative Treatment for Attention Deficit Hyperactivity Disorder in Children,2016,authors;access.localPdfUrl;identifiers.doi